{
  "costs": [
    {
      "completion_latency": 184,
      "issue_duration": 23,
      "resource_windows": [],
      "signature": {
        "kind": "compute",
        "operands": [
          {
            "dtype": "bf16",
            "shape": [
              9,
              64,
              64
            ],
            "space": "shared"
          },
          {
            "dtype": "bf16",
            "shape": [
              64,
              64
            ],
            "space": "shared"
          }
        ],
        "outputs": [
          {
            "expr": [
              "matmul",
              [
                "index",
                [
                  "ref",
                  0
                ],
                0
              ],
              [
                "transpose",
                [
                  "ref",
                  1
                ]
              ]
            ],
            "type": {
              "dtype": "fp32",
              "shape": [
                64,
                64
              ],
              "space": "register"
            }
          }
        ]
      }
    },
    {
      "completion_latency": 184,
      "issue_duration": 23,
      "resource_windows": [],
      "signature": {
        "kind": "compute",
        "operands": [
          {
            "dtype": "bf16",
            "shape": [
              9,
              64,
              64
            ],
            "space": "shared"
          },
          {
            "dtype": "bf16",
            "shape": [
              64,
              64
            ],
            "space": "shared"
          }
        ],
        "outputs": [
          {
            "expr": [
              "matmul",
              [
                "index",
                [
                  "ref",
                  0
                ],
                1
              ],
              [
                "transpose",
                [
                  "ref",
                  1
                ]
              ]
            ],
            "type": {
              "dtype": "fp32",
              "shape": [
                64,
                64
              ],
              "space": "register"
            }
          }
        ]
      }
    },
    {
      "completion_latency": 184,
      "issue_duration": 23,
      "resource_windows": [],
      "signature": {
        "kind": "compute",
        "operands": [
          {
            "dtype": "bf16",
            "shape": [
              9,
              64,
              64
            ],
            "space": "shared"
          },
          {
            "dtype": "bf16",
            "shape": [
              64,
              64
            ],
            "space": "shared"
          }
        ],
        "outputs": [
          {
            "expr": [
              "matmul",
              [
                "index",
                [
                  "ref",
                  0
                ],
                2
              ],
              [
                "transpose",
                [
                  "ref",
                  1
                ]
              ]
            ],
            "type": {
              "dtype": "fp32",
              "shape": [
                64,
                64
              ],
              "space": "register"
            }
          }
        ]
      }
    },
    {
      "completion_latency": 184,
      "issue_duration": 23,
      "resource_windows": [],
      "signature": {
        "kind": "compute",
        "operands": [
          {
            "dtype": "bf16",
            "shape": [
              9,
              64,
              64
            ],
            "space": "shared"
          },
          {
            "dtype": "bf16",
            "shape": [
              64,
              64
            ],
            "space": "shared"
          }
        ],
        "outputs": [
          {
            "expr": [
              "matmul",
              [
                "index",
                [
                  "ref",
                  0
                ],
                3
              ],
              [
                "transpose",
                [
                  "ref",
                  1
                ]
              ]
            ],
            "type": {
              "dtype": "fp32",
              "shape": [
                64,
                64
              ],
              "space": "register"
            }
          }
        ]
      }
    },
    {
      "completion_latency": 184,
      "issue_duration": 23,
      "resource_windows": [],
      "signature": {
        "kind": "compute",
        "operands": [
          {
            "dtype": "bf16",
            "shape": [
              9,
              64,
              64
            ],
            "space": "shared"
          },
          {
            "dtype": "bf16",
            "shape": [
              64,
              64
            ],
            "space": "shared"
          }
        ],
        "outputs": [
          {
            "expr": [
              "matmul",
              [
                "index",
                [
                  "ref",
                  0
                ],
                4
              ],
              [
                "transpose",
                [
                  "ref",
                  1
                ]
              ]
            ],
            "type": {
              "dtype": "fp32",
              "shape": [
                64,
                64
              ],
              "space": "register"
            }
          }
        ]
      }
    },
    {
      "completion_latency": 184,
      "issue_duration": 23,
      "resource_windows": [],
      "signature": {
        "kind": "compute",
        "operands": [
          {
            "dtype": "bf16",
            "shape": [
              9,
              64,
              64
            ],
            "space": "shared"
          },
          {
            "dtype": "bf16",
            "shape": [
              64,
              64
            ],
            "space": "shared"
          }
        ],
        "outputs": [
          {
            "expr": [
              "matmul",
              [
                "index",
                [
                  "ref",
                  0
                ],
                5
              ],
              [
                "transpose",
                [
                  "ref",
                  1
                ]
              ]
            ],
            "type": {
              "dtype": "fp32",
              "shape": [
                64,
                64
              ],
              "space": "register"
            }
          }
        ]
      }
    },
    {
      "completion_latency": 184,
      "issue_duration": 23,
      "resource_windows": [],
      "signature": {
        "kind": "compute",
        "operands": [
          {
            "dtype": "bf16",
            "shape": [
              9,
              64,
              64
            ],
            "space": "shared"
          },
          {
            "dtype": "bf16",
            "shape": [
              64,
              64
            ],
            "space": "shared"
          }
        ],
        "outputs": [
          {
            "expr": [
              "matmul",
              [
                "index",
                [
                  "ref",
                  0
                ],
                6
              ],
              [
                "transpose",
                [
                  "ref",
                  1
                ]
              ]
            ],
            "type": {
              "dtype": "fp32",
              "shape": [
                64,
                64
              ],
              "space": "register"
            }
          }
        ]
      }
    },
    {
      "completion_latency": 184,
      "issue_duration": 23,
      "resource_windows": [],
      "signature": {
        "kind": "compute",
        "operands": [
          {
            "dtype": "bf16",
            "shape": [
              9,
              64,
              64
            ],
            "space": "shared"
          },
          {
            "dtype": "bf16",
            "shape": [
              64,
              64
            ],
            "space": "shared"
          }
        ],
        "outputs": [
          {
            "expr": [
              "matmul",
              [
                "index",
                [
                  "ref",
                  0
                ],
                7
              ],
              [
                "transpose",
                [
                  "ref",
                  1
                ]
              ]
            ],
            "type": {
              "dtype": "fp32",
              "shape": [
                64,
                64
              ],
              "space": "register"
            }
          }
        ]
      }
    },
    {
      "completion_latency": 184,
      "issue_duration": 23,
      "resource_windows": [],
      "signature": {
        "kind": "compute",
        "operands": [
          {
            "dtype": "bf16",
            "shape": [
              9,
              64,
              64
            ],
            "space": "shared"
          },
          {
            "dtype": "bf16",
            "shape": [
              64,
              64
            ],
            "space": "shared"
          }
        ],
        "outputs": [
          {
            "expr": [
              "matmul",
              [
                "index",
                [
                  "ref",
                  0
                ],
                8
              ],
              [
                "transpose",
                [
                  "ref",
                  1
                ]
              ]
            ],
            "type": {
              "dtype": "fp32",
              "shape": [
                64,